run_id,category,expected,observed,status,severity,evidence,skill_update_needed
roomescape-c1-waiting-001,service_boundary,Waiting use cases live in WaitingService,Waiting use cases were initially placed in ReservationService,fail,P1,benchmarks/roomescape-jpa-auth-cycle1-regen,false
roomescape-c1-waiting-001,domain_naming,Entity name uses domain noun Waiting,Entity was initially named ReservationWaiting,fail,P1,benchmarks/roomescape-jpa-auth-cycle1-regen,false
roomescape-c1-waiting-001,rank_strategy,Rank uses direct count/query instead of loading full waiting list,Rank was initially calculated by ordered list lookup and index search,fail,P1,benchmarks/roomescape-jpa-auth-cycle1-regen,true
roomescape-c1-waiting-001,test_layering,Domain/repository/service/controller/acceptance tests are separated,Waiting tests were initially concentrated in acceptance plus partial domain/repository coverage,fail,P1,benchmarks/roomescape-jpa-auth-cycle1-regen,true
roomescape-c1-waiting-001,java_class_ordering,Public method flow is followed by first-called private helpers and getters are last,Ordering convention was not documented before the run,fail,P2,benchmarks/roomescape-jpa-auth-cycle1-regen,true
roomescape-c1-waiting-001,unused_methods,No speculative unused domain methods,Unused slot comparison method remained initially,fail,P2,benchmarks/roomescape-jpa-auth-cycle1-regen,true
roomescape-c1-waiting-002,service_boundary,Waiting use cases live in WaitingService,WaitingService owns waiting create/find/cancel and ReservationService keeps reservation use cases,pass,P1,benchmarks/roomescape-jpa-auth-cycle1-regen-v2,false
roomescape-c1-waiting-002,domain_naming,Entity name uses domain noun Waiting,Entity is named Waiting,pass,P1,benchmarks/roomescape-jpa-auth-cycle1-regen-v2,false
roomescape-c1-waiting-002,rank_strategy,Rank uses direct count/query instead of loading full waiting list,WaitingRepository.countEarlierWaitings calculates rank support,pass,P1,benchmarks/roomescape-jpa-auth-cycle1-regen-v2,false
roomescape-c1-waiting-002,test_layering,Domain/repository/service/controller/acceptance tests are separated,WaitingTest plus WaitingRepositoryIntegrationTest WaitingServiceIntegrationTest WaitingControllerIntegrationTest WaitingAcceptanceTest,pass,P1,benchmarks/roomescape-jpa-auth-cycle1-regen-v2,false
roomescape-c1-waiting-002,java_class_ordering,Public method flow is followed by first-called private helpers and getters are last,Waiting and Reservation domain behavior appears before getters and service helpers follow first public flow,pass,P2,benchmarks/roomescape-jpa-auth-cycle1-regen-v2,false
roomescape-c1-waiting-002,unused_methods,No speculative unused domain methods,No ReservationWaiting or hasSameSlot leftovers in v2 source,pass,P2,benchmarks/roomescape-jpa-auth-cycle1-regen-v2,false
roomescape-c2-change-cancel-error-001,service_boundary,Reservation use cases live in ReservationService and waiting use cases live in WaitingService,Reservation change and cancel are in ReservationService while waiting code remains in WaitingService,pass,P1,benchmarks/roomescape-jpa-auth-cycle2-regen/src/main/java/roomescape/service/ReservationService.java,false
roomescape-c2-change-cancel-error-001,domain_naming,Domain names use user domain nouns Reservation and Waiting,No new mechanically named domain object was introduced,pass,P1,benchmarks/roomescape-jpa-auth-cycle2-regen/src/main/java/roomescape/domain/Reservation.java,false
roomescape-c2-change-cancel-error-001,rank_strategy,Waiting rank uses direct count/query instead of loading full waiting list,Existing WaitingRepository.countEarlierWaitings remains the rank mechanism,pass,P1,benchmarks/roomescape-jpa-auth-cycle2-regen/src/main/java/roomescape/repository/WaitingRepository.java,false
roomescape-c2-change-cancel-error-001,test_layering,Core flows and important failures have acceptance plus focused layer tests,Added ReservationAcceptanceTest ReservationServiceIntegrationTest ReservationControllerIntegrationTest ReservationTimeControllerIntegrationTest ReservationRepositoryIntegrationTest and ReservationTest coverage,pass,P1,benchmarks/roomescape-jpa-auth-cycle2-regen/src/test/java/roomescape,false
roomescape-c2-change-cancel-error-001,java_class_ordering,Public flow is followed by first-called private helpers and getters are last,Reservation behavior stays before getters and service helpers sit under the first public flow that calls them,pass,P2,benchmarks/roomescape-jpa-auth-cycle2-regen/src/main/java/roomescape/domain/Reservation.java,false
roomescape-c2-change-cancel-error-001,unused_methods,No speculative unused methods remain,Added production methods are used by controller service or repository flows and test helpers are exercised,pass,P2,benchmarks/roomescape-jpa-auth-cycle2-regen,false
roomescape-c2-change-cancel-error-001,api_contract,Create 201 read 200 update 200 delete 204 and non-owned user resources return not found,PUT reservation change returns 200 delete reservation and time return 204 and non-owned reservation returns RESERVATION_NOT_FOUND,pass,P1,benchmarks/roomescape-jpa-auth-cycle2-regen/src/main/java/roomescape/controller/ReservationController.java,false
roomescape-c2-change-cancel-error-001,exception_style,One ErrorResponse code-message style with central ErrorCode to status mapping,New errors and invalid input handlers use RoomescapeException ErrorCodeStatusMapper and ErrorResponse,pass,P1,benchmarks/roomescape-jpa-auth-cycle2-regen/src/main/java/roomescape/exception,false
roomescape-c2-change-cancel-error-001,transaction_boundary,DB services default to readOnly and write methods use @Transactional,ReservationService and ReservationTimeService keep class readOnly and write methods annotated,pass,P1,benchmarks/roomescape-jpa-auth-cycle2-regen/src/main/java/roomescape/service,false
roomescape-c2-change-cancel-error-001,repository_query_readability,Use readable derived queries unless JPQL is clearer,Added existsByThemeAndTimeAndDateAndIdNot and existsByTime derived queries remain readable,pass,P2,benchmarks/roomescape-jpa-auth-cycle2-regen/src/main/java/roomescape/repository/ReservationRepository.java,false
roomescape-c2-change-cancel-error-001,documentation,README includes cycle2 feature list and API error spec,README documents cycle2 feature list API decisions error response spec and test decisions,pass,P2,benchmarks/roomescape-jpa-auth-cycle2-regen/README.md,false
roomescape-c2-change-cancel-error-001,verification,Run narrow relevant test before full Gradle verification,ReservationAcceptanceTest targeted run passed and ./gradlew clean test passed,pass,P1,benchmarks/benchmark-records/runs/roomescape-c2-change-cancel-error-001.md,false
roomescape-c2-waiting-approval-001,service_boundary,Reservation workflow stays in ReservationService and waiting approval stays in WaitingService,ReservationService triggers approval only when a reservation slot is vacated and WaitingService owns first waiting conversion,pass,P1,benchmarks/roomescape-jpa-auth-cycle2-regen/src/main/java/roomescape/service,false
roomescape-c2-waiting-approval-001,domain_naming,Reuse user domain nouns Reservation and Waiting,No new mechanically named conversion entity was introduced,pass,P1,benchmarks/roomescape-jpa-auth-cycle2-regen/src/main/java/roomescape/domain,false
roomescape-c2-waiting-approval-001,rank_strategy,Rank recalculation uses direct query/count rather than stored rank or full list index search,Existing WaitingRepository.countEarlierWaitings remains the rank source after promotion,pass,P1,benchmarks/roomescape-jpa-auth-cycle2-regen/src/main/java/roomescape/repository/WaitingRepository.java,false
roomescape-c2-waiting-approval-001,test_layering,New core behavior has domain repository service transaction and acceptance coverage,Added Waiting approve domain test first-waiting repository test reservation service promotion tests approval rollback test and acceptance rank recalculation test,pass,P1,benchmarks/roomescape-jpa-auth-cycle2-regen/src/test/java/roomescape,false
roomescape-c2-waiting-approval-001,java_class_ordering,Public method flow is followed by first-called private helpers and getters are last,Service helpers follow public flow and domain behavior remains above getters,pass,P2,benchmarks/roomescape-jpa-auth-cycle2-regen/src/main/java/roomescape,false
roomescape-c2-waiting-approval-001,unused_methods,No speculative unused methods remain,Reservation.hasSchedule and Waiting.approve are used by production code,pass,P2,benchmarks/roomescape-jpa-auth-cycle2-regen/src/main/java/roomescape/domain,false
roomescape-c2-waiting-approval-001,api_contract,Existing reservation PUT and DELETE contracts remain stable,No new public approval API was added and existing PUT 200 DELETE 204 behavior remains covered,pass,P1,benchmarks/roomescape-jpa-auth-cycle2-regen/src/test/java/roomescape/ReservationAcceptanceTest.java,false
roomescape-c2-waiting-approval-001,exception_style,Use one ErrorResponse and ErrorCode style,Approval persistence conflict reuses DUPLICATE_RESERVATION through RoomescapeException,pass,P1,benchmarks/roomescape-jpa-auth-cycle2-regen/src/main/java/roomescape/service/WaitingService.java,false
roomescape-c2-waiting-approval-001,transaction_boundary,Reservation vacancy and first waiting approval commit or roll back together,ReservationService keeps the use case transaction and flushes the old reservation before WaitingService creates the promoted reservation,pass,P1,benchmarks/roomescape-jpa-auth-cycle2-regen/src/main/java/roomescape/service/ReservationService.java,false
roomescape-c2-waiting-approval-001,repository_query_readability,First waiting lookup is readable and DB-backed,findFirstByThemeAndTimeAndDateOrderByCreatedAtAscIdAsc expresses the slot and order directly,pass,P2,benchmarks/roomescape-jpa-auth-cycle2-regen/src/main/java/roomescape/repository/WaitingRepository.java,false
roomescape-c2-waiting-approval-001,documentation,README records feature list API decision and transaction boundary,README includes Cycle 2 Waiting Approval section,pass,P2,benchmarks/roomescape-jpa-auth-cycle2-regen/README.md,false
roomescape-c2-waiting-approval-001,verification,Run narrow relevant tests before full Gradle verification,Targeted domain repository service acceptance test passed and ./gradlew clean test passed,pass,P1,benchmarks/benchmark-records/runs/roomescape-c2-waiting-approval-001.md,false
roomescape-authz-manager-001,service_boundary,Store bootstrap and manager reservation management have clear service homes,StoreService owns stores and ReservationService owns reservation management flows,pass,P1,benchmarks/roomescape-jpa-auth-cycle2-regen/src/main/java/roomescape/service,false
roomescape-authz-manager-001,domain_naming,Store is represented with the domain noun,New entity is named Store,pass,P1,benchmarks/roomescape-jpa-auth-cycle2-regen/src/main/java/roomescape/domain/Store.java,false
roomescape-authz-manager-001,authorization_boundary,Controller delegates authz and domain/service own authorization policy,ManagerReservationController delegates ReservationService coordinates lookup and Store Theme Reservation answer managed ownership,pass,P1,benchmarks/roomescape-jpa-auth-cycle2-regen/src/main/java/roomescape,false
roomescape-authz-manager-001,test_layering,Domain repository service controller and acceptance tests cover core authz behavior,Added StoreTest ThemeTest StoreRepositoryIntegrationTest ManagerReservationServiceIntegrationTest ManagerReservationControllerIntegrationTest ManagerAuthorizationAcceptanceTest and repository query coverage,pass,P1,benchmarks/roomescape-jpa-auth-cycle2-regen/src/test/java/roomescape,false
roomescape-authz-manager-001,java_class_ordering,Public method flow is followed by first-called private helpers and domain behavior appears before getters,New services and domains follow ordering and Member behavior was moved above getters,pass,P2,benchmarks/roomescape-jpa-auth-cycle2-regen/src/main/java/roomescape,false
roomescape-authz-manager-001,api_contract,Authentication and authorization failures are separate and existing APIs stay compatible,Missing token returns UNAUTHORIZED non-manager or cross-store access returns FORBIDDEN and ThemeRequest storeId is optional,pass,P1,benchmarks/roomescape-jpa-auth-cycle2-regen/src/test/java/roomescape,false
roomescape-authz-manager-001,exception_style,Use one ErrorResponse and ErrorCode style,Added FORBIDDEN STORE_NOT_FOUND MEMBER_NOT_FOUND MANAGER_ALREADY_HAS_STORE to central mapper,pass,P1,benchmarks/roomescape-jpa-auth-cycle2-regen/src/main/java/roomescape/exception,false
roomescape-authz-manager-001,transaction_boundary,Reservation mutation uses existing transaction behavior,Manager change and delete call the same transactional reservation mutation flow,pass,P1,benchmarks/roomescape-jpa-auth-cycle2-regen/src/main/java/roomescape/service/ReservationService.java,false
roomescape-authz-manager-001,repository_query_readability,Store-scoped reservation lookup is readable,findAllByThemeStoreOrderByDateAscTimeStartAtAsc remains readable,pass,P2,benchmarks/roomescape-jpa-auth-cycle2-regen/src/main/java/roomescape/repository/ReservationRepository.java,false
roomescape-authz-manager-001,documentation,README records audit feature list API and authorization decisions,README includes Auth Authorization Add-On section,pass,P2,benchmarks/roomescape-jpa-auth-cycle2-regen/README.md,false
roomescape-authz-manager-001,verification,Run narrow relevant tests before full Gradle verification,Targeted authz tests passed and ./gradlew clean test passed,pass,P1,benchmarks/benchmark-records/runs/roomescape-authz-manager-001.md,false
roomescape-auth-concurrent-login-001,auth_session_state,Server-side state is explicit when bearer tokens must be invalidated,AuthSession stores current session key per member and tokens carry member id plus session key,pass,P1,benchmarks/roomescape-jpa-auth-cycle2-regen/src/main/java/roomescape/domain/AuthSession.java,false
roomescape-auth-concurrent-login-001,service_boundary,Login rotation stays in AuthService and request validation stays in auth resolver,AuthService.login rotates session and LoginMemberArgumentResolver validates token against current session,pass,P1,benchmarks/roomescape-jpa-auth-cycle2-regen/src/main/java/roomescape,false
roomescape-auth-concurrent-login-001,domain_naming,Login state uses domain-auth language,New entity is named AuthSession,pass,P2,benchmarks/roomescape-jpa-auth-cycle2-regen/src/main/java/roomescape/domain/AuthSession.java,false
roomescape-auth-concurrent-login-001,test_layering,Domain service controller and acceptance tests cover stale token behavior,New tests cover rotation stale token rejection and latest token success,pass,P1,benchmarks/roomescape-jpa-auth-cycle2-regen/src/test/java/roomescape,false
roomescape-auth-concurrent-login-001,java_class_ordering,Behavior before getters and helpers under public flow,AuthSession rotate and matches precede getters and AuthService renewSession sits below login,pass,P2,benchmarks/roomescape-jpa-auth-cycle2-regen/src/main/java/roomescape,false
roomescape-auth-concurrent-login-001,api_contract,Existing login response stays stable and stale tokens return unauthorized,LoginResponse accessToken unchanged and stale token responses use UNAUTHORIZED,pass,P1,benchmarks/roomescape-jpa-auth-cycle2-regen/src/test/java/roomescape,false
roomescape-auth-concurrent-login-001,exception_style,Use one ErrorResponse and ErrorCode style,Stale session uses existing UNAUTHORIZED through RoomescapeException,pass,P1,benchmarks/roomescape-jpa-auth-cycle2-regen/src/main/java/roomescape/auth/LoginMemberArgumentResolver.java,false
roomescape-auth-concurrent-login-001,transaction_boundary,Login session replacement is atomic,AuthService.login is write-transactional and saves current session,pass,P1,benchmarks/roomescape-jpa-auth-cycle2-regen/src/main/java/roomescape/service/AuthService.java,false
roomescape-auth-concurrent-login-001,documentation,README explains stateless trade-off and policy,README documents newest-login-wins AuthSession and per-request lookup trade-off,pass,P2,benchmarks/roomescape-jpa-auth-cycle2-regen/README.md,false
roomescape-auth-concurrent-login-001,verification,Run narrow relevant tests before full Gradle verification,Targeted auth tests and ./gradlew clean test passed,pass,P1,benchmarks/benchmark-records/runs/roomescape-auth-concurrent-login-001.md,false
roomescape-jpa-addon-001,external_scope,External API requirements are removed from project scope,External API requirement files and README references were removed,pass,P2,missions/roomescape-reservation-waiting,false
roomescape-jpa-addon-001,jpa_mapping,Project uses JPA repositories and entity relationships,Target project already uses Spring Data JPA entities and repositories,pass,P1,benchmarks/roomescape-jpa-auth-cycle2-regen/src/main/java/roomescape,false
roomescape-jpa-addon-001,endpoint_compatibility,JPA add-on API paths work without breaking existing API paths,Added /reservations-mine /waitings and /waitings/{waitingId} aliases,pass,P1,benchmarks/roomescape-jpa-auth-cycle2-regen/src/main/java/roomescape/controller,false
roomescape-jpa-addon-001,admin_waiting_management,Admin can list and cancel waitings,Added GET /admin/waitings and DELETE /admin/waitings/{waitingId},pass,P1,benchmarks/roomescape-jpa-auth-cycle2-regen/src/main/java/roomescape/controller/WaitingController.java,false
roomescape-jpa-addon-001,service_boundary,Waiting use cases remain in WaitingService,Admin waiting management and member waiting management share WaitingService,pass,P1,benchmarks/roomescape-jpa-auth-cycle2-regen/src/main/java/roomescape/service/WaitingService.java,false
roomescape-jpa-addon-001,rank_strategy,Waiting rank stays direct query/count based,Existing countEarlierWaitings remains the rank source for admin and member views,pass,P1,benchmarks/roomescape-jpa-auth-cycle2-regen/src/main/java/roomescape/repository/WaitingRepository.java,false
roomescape-jpa-addon-001,test_layering,New compatibility/admin behavior is tested,JpaAddOnAcceptanceTest covers aliases and admin waiting management and existing layer tests remain,pass,P1,benchmarks/roomescape-jpa-auth-cycle2-regen/src/test/java/roomescape/JpaAddOnAcceptanceTest.java,false
roomescape-jpa-addon-001,java_class_ordering,New methods follow public flow and helper placement,findAll cancelByAdmin and findWaiting are ordered with related waiting flows,pass,P2,benchmarks/roomescape-jpa-auth-cycle2-regen/src/main/java/roomescape/service/WaitingService.java,false
roomescape-jpa-addon-001,documentation,README records audit and implementation decisions,README includes JPA Add-On Completion section,pass,P2,benchmarks/roomescape-jpa-auth-cycle2-regen/README.md,false
roomescape-jpa-addon-001,verification,Run narrow relevant tests before full Gradle verification,Targeted tests and ./gradlew clean test passed,pass,P1,benchmarks/benchmark-records/runs/roomescape-jpa-addon-001.md,false
roomescape-convention-correction-001,admin_authorization_consistency,All admin APIs require LoginMember and service level admin validation,AdminAuthorizationService validates ADMIN for admin managers stores themes times and waitings while admin accounts are seeded outside public API,pass,P1,benchmarks/roomescape-jpa-auth-cycle2-regen/src/main/java/roomescape/service/AdminAuthorizationService.java,true
roomescape-convention-correction-001,read_model_boundary,MyReservationService owns the combined my reservations read model,MyReservationService now queries reservation and waiting repositories and ReservationService WaitingService no longer create MyReservationResponse,pass,P1,benchmarks/roomescape-jpa-auth-cycle2-regen/src/main/java/roomescape/service/MyReservationService.java,true
roomescape-convention-correction-001,uri_convention,Waiting is a peer resource exposed under waitings not reservations waitings,WaitingController exposes POST /waitings and DELETE /waitings/{waitingId} only,pass,P1,benchmarks/roomescape-jpa-auth-cycle2-regen/src/main/java/roomescape/controller/WaitingController.java,true
roomescape-convention-correction-001,compatibility_alias_policy,Do not expose compatibility aliases unless explicitly required and documented,ReservationController removed /reservations-mine and WaitingController removed nested waiting aliases,pass,P1,benchmarks/roomescape-jpa-auth-cycle2-regen/src/main/java/roomescape/controller,false
roomescape-convention-correction-001,java_class_ordering,Public method flow is followed by first called private helpers,ReservationTimeService and touched services keep helpers directly below first public caller,pass,P2,benchmarks/roomescape-jpa-auth-cycle2-regen/src/main/java/roomescape/service/ReservationTimeService.java,true
roomescape-convention-correction-001,test_layering,Convention fixes have focused integration and acceptance regression coverage,Added AdminAuthorizationControllerIntegrationTest and updated canonical path admin waiting tests,pass,P1,benchmarks/roomescape-jpa-auth-cycle2-regen/src/test/java/roomescape,false
roomescape-convention-correction-001,documentation,README records admin provisioning and canonical waiting paths,README documents admin only APIs no public admin bootstrap and canonical waitings path,pass,P2,benchmarks/roomescape-jpa-auth-cycle2-regen/README.md,false
roomescape-convention-correction-001,verification,Run targeted tests before full Gradle verification,Targeted admin waiting time manager tests and ./gradlew clean test passed,pass,P1,benchmarks/benchmark-records/runs/roomescape-convention-correction-001.md,false
roomescape-convention-correction-002,authorization_boundary,Admin and manager authorization use the same boundary style,Assistant-created mismatch was fixed by keeping AdminAuthorizationService and adding ManagerAuthorizationService plus AuthenticatedMemberService,pass,P1,benchmarks/roomescape-jpa-auth-cycle2-regen/src/main/java/roomescape/service,true
roomescape-convention-correction-002,promotion_orchestration,Reservation-waiting promotion has one usecase owner,Assistant-created split between ReservationService and WaitingService was fixed with WaitingPromotionService,pass,P1,benchmarks/roomescape-jpa-auth-cycle2-regen/src/main/java/roomescape/service/WaitingPromotionService.java,true
roomescape-convention-correction-002,lookup_policy,Repeated authenticated member and reference lookup should not drift,Assistant-created duplicated LoginMember lookup was fixed with AuthenticatedMemberService and theme/time getByIdOrThrow repository helpers,pass,P2,benchmarks/roomescape-jpa-auth-cycle2-regen/src/main/java/roomescape/service/AuthenticatedMemberService.java,true
roomescape-convention-correction-002,reservation_time_query,Use existing bulk query instead of per-row exists mapping,Assistant-created inefficient mapping was fixed by using findAllByThemeAndDate and reserved time id set,pass,P2,benchmarks/roomescape-jpa-auth-cycle2-regen/src/main/java/roomescape/service/ReservationTimeService.java,true
roomescape-convention-correction-002,controller_grouping,Controller grouping should follow one resource-oriented rule,Assistant-created role/resource mixing was fixed by moving manager reservation endpoints into ReservationController and deleting ManagerReservationController,pass,P2,benchmarks/roomescape-jpa-auth-cycle2-regen/src/main/java/roomescape/controller/ReservationController.java,true
roomescape-convention-correction-002,java_class_ordering,MemberService helper placement follows user's explicit convention,No change made because create-helper-createManager matches public flow followed by first-called private helper,pass,P3,benchmarks/roomescape-jpa-auth-cycle2-regen/src/main/java/roomescape/service/MemberService.java,false
roomescape-convention-correction-002,test_layering,Behavioral regression tests remain focused after structural correction,Updated promotion transaction and manager authorization controller tests while existing acceptance tests remain,pass,P1,benchmarks/roomescape-jpa-auth-cycle2-regen/src/test/java/roomescape,false
roomescape-convention-correction-002,documentation,README records corrected ownership and authorization conventions,README now documents WaitingPromotionService AuthenticatedMemberService ManagerAuthorizationService and resource controller grouping,pass,P2,benchmarks/roomescape-jpa-auth-cycle2-regen/README.md,false
roomescape-convention-correction-002,verification,Run targeted tests before full Gradle verification,Targeted authorization promotion time reservation waiting tests and ./gradlew clean test passed,pass,P1,benchmarks/benchmark-records/runs/roomescape-convention-correction-002.md,false
roomescape-convention-correction-003,dto_factory_naming,Use from for one-source DTO conversion and of for conversion needing additional calculated values,MyReservationResponse.fromWaiting was renamed to ofWaiting while existing WaitingResponse.of and ReservationTimeResponse.of remain consistent,pass,P2,benchmarks/roomescape-jpa-auth-cycle2-regen/src/main/java/roomescape/dto/MyReservationResponse.java,true
roomescape-convention-correction-003,authentication_boundary,Argument resolver extracts web input and auth service owns token session member validation,LoginMemberArgumentResolver now extracts bearer token only and delegates authentication to AuthService.authenticate,pass,P1,benchmarks/roomescape-jpa-auth-cycle2-regen/src/main/java/roomescape/auth/LoginMemberArgumentResolver.java,true
roomescape-convention-correction-003,validation_helper_consistency,Sibling use cases in a service use the same named validation helper style,ReservationService.create now uses validateCreateAllowed matching validateChangeAllowed and WaitingService validateWaitingAllowed,pass,P2,benchmarks/roomescape-jpa-auth-cycle2-regen/src/main/java/roomescape/service/ReservationService.java,true
